{
  "id": "CLM-002",
  "title": "Shipped source defines a 320px field and 16 units per pixel",
  "classification": "demo-safe",
  "status": "single-source-reading",
  "asset_id": "DRV-027",
  "locator": "c:define/SCREEN_W",
  "statement_kind": "literal-value",
  "statement": "SCREEN_W は 320 と定義され、UNITS_PER_PX は 16 と定義されている。",
  "does_not_establish": "この定数が旧sheetの値からどのように導かれたか、あるいは無関係かどうか。"
}
